Case No.,Client Name Case Type,Status,Lead Attorney,Date Filed
2024-001,TechCorp Inc. Contract Dispute,Discovery,J. Smith,2024-01-15
2024-002,Green Energy LLC Regulatory Compliance,Active,S. Johnson,2024-02-03
2024-003,Metro Properties Real Estate Transaction,Closing,M. Davis,2024-02-20
2024-004,DataSafe Systems IP Infringement,Litigation,J. Smith,2024-03-01
2024-005,HealthFirst Medical Employment Law,Mediation,L. Wilson,2024-03-10
2024-006,AutoParts Direct Product Liability,Investigation,S. Johnson,2024-03-12
